{
  "$schema": "./strategies.schema.json",
  "version": 1,
  "catalogName": "NeuroDiver Strategy Navigator",
  "updatedAt": "2026-07-04",
  "strategies": 
  [
      {
        "id": "ef-the-doorway-problem",
        "title": "The Doorway Problem",
        "category": "Executive Function",
        "challenge": "Task initiation",
        "situation": "I know exactly what I need to do. I'm just standing here, and I can't make myself start.",
        "internalThoughts": "What is wrong with me? It's such a small thing.",
        "gentleReminder": "Knowing what to do and being able to start doing it are two different skills. Your brain isn't refusing out of laziness. That gap is real, and it's common.",
        "whatsHappening": "Starting a task takes a kind of mental ignition, something that switches your brain from thinking about it to doing it. For a lot of brains that switch doesn't fire reliably, especially for tasks with no built-in urgency or reward. This isn't about willpower.",
        "tryThis": [
          "Set a timer for two minutes and do only the very first physical motion.",
          "Say the task out loud to yourself before starting.",
          "Change your body position first, then start.",
          "Ask someone to keep you company while you begin, even on a call.",
          "Shrink the task down to a version so small it feels silly not to do."
        ],
        "whyThisHelps": "Each of these gives your brain a smaller, more concrete entry point than the full task, which lowers the effort needed to begin.",
        "expectedOutcome": "Increase task initiation and reduce time spent stuck before starting.",
        "estimatedTime": "2 min",
        "energyRequired": "Low",
        "difficulty": "Easy",
        "bestWhen": [
          "Running Low",
          "Steady"
        ],
        "tags": [
          "task initiation",
          "starting",
          "procrastination",
          "executive function"
        ],
        "relatedStrategies": [
          "ef-two-minute-entry",
          "ef-body-before-brain",
          "ef-starting-strong-fading-fast"
        ],
        "evidenceLevel": "Clinical practice",
        "source": "Consistent with ADHD and executive function coaching approaches to task initiation.",
        "status": "Published"
      },
      {
        "id": "ef-two-minute-entry",
        "title": "Two-Minute Entry",
        "category": "Executive Function",
        "challenge": "Task initiation",
        "situation": "The whole task feels huge, so I never even open the door to start it.",
        "internalThoughts": "If I start, I have to finish it all. I don't have the energy for that.",
        "gentleReminder": "It makes sense to avoid something that feels enormous. The size of the task in your head, not the actual first step, is often what's stopping you.",
        "whatsHappening": "Big tasks can trigger overwhelm before you've even begun, because your brain tries to picture the whole thing at once. Shrinking the entry point changes what you're actually being asked to do.",
        "tryThis": [
          "Pick the smallest possible action connected to the task.",
          "Commit to doing only that action, with permission to stop after.",
          "If you keep going, treat it as a bonus, not the plan.",
          "Repeat this small entry point next time you return to the task."
        ],
        "whyThisHelps": "It replaces an overwhelming task with a tiny, low-stakes one, which makes starting far less effortful.",
        "expectedOutcome": "Lower activation energy and increase task initiation.",
        "estimatedTime": "2 min",
        "energyRequired": "Low",
        "difficulty": "Easy",
        "bestWhen": [
          "Running Low",
          "Steady"
        ],
        "tags": [
          "task initiation",
          "procrastination",
          "micro-tasking",
          "overwhelm"
        ],
        "relatedStrategies": [
          "ef-the-doorway-problem",
          "ef-starting-strong-fading-fast"
        ],
        "evidenceLevel": "Clinical practice",
        "source": "Common technique in ADHD coaching, sometimes called micro-tasking.",
        "status": "Published"
      },
      {
        "id": "ef-body-before-brain",
        "title": "Body Before Brain",
        "category": "Executive Function",
        "challenge": "Task initiation",
        "situation": "I've been sitting here for twenty minutes trying to think my way into starting.",
        "internalThoughts": "If I just focus harder, I'll get moving.",
        "gentleReminder": "Trying to think your way into motion doesn't always work, and that's not a failure of focus. Sometimes the body needs to move first.",
        "whatsHappening": "For some brains, thinking about a task keeps you in planning mode indefinitely. Moving your body, even briefly, can interrupt that loop and shift you into doing mode.",
        "tryThis": [
          "Stand up and stretch for 30 seconds before returning to the task.",
          "Walk to another room and back.",
          "Do ten jumping jacks or a lap around your space.",
          "Return to the task right after moving, before sitting back down to think again."
        ],
        "whyThisHelps": "Physical movement can shift your nervous system state, making it easier to transition out of an overthinking loop.",
        "expectedOutcome": "Reduce time spent stuck before starting and increase task initiation.",
        "estimatedTime": "2 min",
        "energyRequired": "Low",
        "difficulty": "Easy",
        "bestWhen": [
          "Running Low",
          "Steady"
        ],
        "tags": [
          "task initiation",
          "movement",
          "stuck",
          "freeze"
        ],
        "relatedStrategies": [
          "ef-the-doorway-problem",
          "sm-the-crash-after-the-zone"
        ],
        "evidenceLevel": "Community-informed",
        "source": "Widely reported strategy in ADHD and autism communities.",
        "status": "Published"
      },
      {
        "id": "ef-everything-feels-urgent",
        "title": "Everything Feels Urgent",
        "category": "Executive Function",
        "challenge": "Prioritisation",
        "situation": "I have twenty things to do and they all feel equally important. I don't know where to start.",
        "internalThoughts": "I should be able to figure out what matters most. Why can't I just tell?",
        "gentleReminder": "When everything feels urgent, that's not a sign you're bad at prioritising. Your brain isn't automatically ranking tasks the way some brains do, and that ranking has to be built on purpose.",
        "whatsHappening": "Prioritising means holding several tasks in mind and weighing them against each other, which is demanding on its own. Without a clear structure, everything can end up feeling the same size.",
        "tryThis": [
          "Write every task down, even the small ones.",
          "Sort into four groups: urgent and important, important but not urgent, urgent but not important, neither.",
          "Circle only the urgent-and-important group.",
          "Pick one task from that group to do next.",
          "Let the rest wait without guilt."
        ],
        "whyThisHelps": "External sorting takes the ranking work off your brain and turns a vague pile into a visible, manageable structure.",
        "expectedOutcome": "Reduce decision fatigue and increase clarity on what to do next.",
        "estimatedTime": "10 min",
        "energyRequired": "Medium",
        "difficulty": "Moderate",
        "bestWhen": [
          "Steady",
          "High Energy"
        ],
        "tags": [
          "prioritisation",
          "overwhelm",
          "task list",
          "decision fatigue"
        ],
        "relatedStrategies": [
          "ef-the-one-thing-filter",
          "ef-too-many-options-no-decision"
        ],
        "evidenceLevel": "Research-supported",
        "source": "Based on the Eisenhower Matrix, a widely used prioritisation framework.",
        "status": "Published"
      },
      {
        "id": "ef-the-one-thing-filter",
        "title": "The One-Thing Filter",
        "category": "Executive Function",
        "challenge": "Prioritisation",
        "situation": "My to-do list has so much on it that I freeze and end up doing nothing.",
        "internalThoughts": "If I can't do it all, what's even the point of starting?",
        "gentleReminder": "A long list can make everything feel like the only acceptable outcome. It's reasonable that facing all of it at once leads to freezing instead of moving.",
        "whatsHappening": "When a task list feels infinite, your brain has nowhere to land. Narrowing the question to a single item gives it one answerable target instead of an open-ended one.",
        "tryThis": [
          "Look at your full list without trying to plan the whole day.",
          "Ask yourself what would matter most if you only got one thing done today.",
          "Write that one thing somewhere visible, separate from the rest of the list.",
          "Do that one thing before looking at anything else."
        ],
        "whyThisHelps": "Reducing the decision to a single item removes the paralysis that comes from weighing everything at once.",
        "expectedOutcome": "Increase task initiation and reduce decision fatigue.",
        "estimatedTime": "5 min",
        "energyRequired": "Low",
        "difficulty": "Easy",
        "bestWhen": [
          "Running Low",
          "Steady"
        ],
        "tags": [
          "prioritisation",
          "focus",
          "task list",
          "simplifying"
        ],
        "relatedStrategies": [
          "ef-everything-feels-urgent",
          "ef-starting-strong-fading-fast"
        ],
        "evidenceLevel": "Community-informed",
        "source": "Common technique in productivity and ADHD coaching circles.",
        "status": "Published"
      },
      {